<?xml version="1.0" encoding="iso8859-1"?>
<!ELEMENT entities-table (entity)*>

<!ELEMENT entity EMPTY>
<!ATTLIST entity
  name  CDATA #REQUIRED
  value CDATA #REQUIRED
>

